{
  "name": "Programming Agent Skill Dictionary",
  "version": "0.3.0",
  "domain": "programming",
  "updated_at": "2026-05-24",
  "entries": [
    {
      "code": "查",
      "name": "inspect",
      "definition": "只读调查项目、文件、结构、原因，不修改代码。",
      "intent_examples": [
        "看看项目结构",
        "找一下入口",
        "查一下为什么失败"
      ],
      "bound_skill_patterns": [
        "read_only_exploration",
        "context_collection"
      ],
      "allowed_actions": [
        "read_files",
        "search_code",
        "run_read_only_commands"
      ],
      "forbidden_actions": [
        "edit_files",
        "install_dependency",
        "commit_changes"
      ],
      "tool_policy": {
        "read": "allowed",
        "write": "forbidden",
        "network": "approval_required",
        "dependency_install": "forbidden"
      },
      "runtime_environment": {
        "auto_inject_local_env": true,
        "context_breaker_on_switch": true,
        "evidence_capture": "system_sandbox",
        "audit_log_write_access": "system_only"
      },
      "routing_target": "inspect_workflow",
      "model_policy": {
        "temperature": 0.0,
        "max_retry_limit": 1,
        "load_minimal_context": true,
        "prefer_deterministic_steps": true
      },
      "required_steps": [
        "定位相关文件",
        "读取必要上下文",
        "输出调查结论和不确定项"
      ],
      "verification": {
        "required": false,
        "evidence_source": "system_sandbox_stdout_stderr",
        "acceptable_evidence": [
          "file_search_result"
        ],
        "audit_fields": [
          "timestamp",
          "command",
          "exit_code",
          "stdout_digest",
          "stderr_digest",
          "sha256"
        ]
      },
      "fallback": {
        "when_confidence_below": 0.75,
        "action": "ask_clarifying_question",
        "on_max_retry_exceeded": "MELT_DOWN_TO_查",
        "on_meltdown": "revoke_write_permissions_and_emit_bug_report"
      },
      "reference_workflow_patterns": [
        "superpowers:using-superpowers",
        "multi-agent:reader-only",
        "engineering:context-collection"
      ],
      "professional_protocol": {
        "source_projects": [
          "Claude Code Agent Skills",
          "SWE-agent Agent Computer Interface",
          "Reader-only subagent pattern"
        ],
        "operating_logic": [
          "只读枚举项目入口、目录、配置和相关文件",
          "用搜索结果缩小范围，只读取完成判断所需的最小上下文",
          "输出已确认事实、推断依据和未解决问题，禁止顺手修改"
        ],
        "hard_gates": [
          "不得调用写文件、安装依赖、提交代码或部署工具",
          "不确定时保留问题，不把猜测写成结论"
        ]
      },
      "root_opcode": "查",
      "opcode_vector": {
        "permission": "read_only",
        "context": "minimal_read_context",
        "evidence": [
          "file_reference",
          "line_range",
          "search_result_hash"
        ]
      },
      "inheritance_policy": {
        "can_relax_permission": false,
        "can_add_evidence": true,
        "context_must_not_expand": true
      },
      "six_phase_workflow": [
        "确认调查目标",
        "定位相关文件、日志、配置或来源",
        "读取最小必要上下文",
        "区分事实、推断和未知项",
        "输出证据路径、行号或来源",
        "推荐下一执行字"
      ],
      "transition_policy": {
        "on_success": [
          "总"
        ],
        "on_failure": [
          "问"
        ],
        "on_risk": [
          "卫"
        ]
      }
    },
    {
      "code": "解",
      "name": "explain",
      "definition": "解释代码、报错、架构或概念，不修改代码。",
      "intent_examples": [
        "这是什么意思",
        "解释一下这段代码",
        "这个报错什么意思"
      ],
      "bound_skill_patterns": [
        "structured_explanation",
        "documentation"
      ],
      "allowed_actions": [
        "read_files",
        "search_code"
      ],
      "forbidden_actions": [
        "edit_files",
        "install_dependency",
        "claim_unverified_runtime_behavior"
      ],
      "tool_policy": {
        "read": "allowed",
        "write": "forbidden",
        "network": "approval_required",
        "dependency_install": "forbidden"
      },
      "runtime_environment": {
        "auto_inject_local_env": true,
        "context_breaker_on_switch": true,
        "evidence_capture": "system_sandbox",
        "audit_log_write_access": "system_only"
      },
      "routing_target": "explain_workflow",
      "model_policy": {
        "temperature": 0.1,
        "max_retry_limit": 1,
        "load_minimal_context": true,
        "prefer_deterministic_steps": true
      },
      "required_steps": [
        "读取必要上下文",
        "区分事实与推断",
        "按结构解释"
      ],
      "verification": {
        "required": false,
        "evidence_source": "system_sandbox_stdout_stderr",
        "acceptable_evidence": [
          "source_reference"
        ],
        "audit_fields": [
          "timestamp",
          "command",
          "exit_code",
          "stdout_digest",
          "stderr_digest",
          "sha256"
        ]
      },
      "fallback": {
        "when_confidence_below": 0.75,
        "action": "ask_clarifying_question_or_route_to_查",
        "on_max_retry_exceeded": "MELT_DOWN_TO_查",
        "on_meltdown": "revoke_write_permissions_and_emit_bug_report"
      },
      "reference_workflow_patterns": [
        "documentation:structured-explanation",
        "engineering:fact-vs-inference"
      ],
      "professional_protocol": {
        "source_projects": [
          "Claude Agent Skills documentation pattern",
          "OpenAI Skills portable capability pattern",
          "Engineering documentation workflows"
        ],
        "operating_logic": [
          "先读取原始代码、报错或架构上下文",
          "把解释拆成事实、执行流程、数据流和推断边界",
          "面向用户当前问题解释，不扩展成无关教程"
        ],
        "hard_gates": [
          "禁止修改代码",
          "禁止声称未运行过的行为已经验证"
        ]
      },
      "root_opcode": "查",
      "opcode_vector": {
        "permission": "read_only",
        "context": "minimal_read_context",
        "evidence": [
          "file_reference",
          "line_range",
          "search_result_hash"
        ]
      },
      "inheritance_policy": {
        "can_relax_permission": false,
        "can_add_evidence": true,
        "context_must_not_expand": true
      },
      "six_phase_workflow": [
        "确认调查目标",
        "定位相关文件、日志、配置或来源",
        "读取最小必要上下文",
        "区分事实、推断和未知项",
        "输出证据路径、行号或来源",
        "推荐下一执行字"
      ],
      "transition_policy": {
        "on_success": [
          "总"
        ],
        "on_failure": [
          "问"
        ],
        "on_risk": [
          "卫"
        ]
      }
    },
    {
      "code": "修",
      "name": "fix",
      "definition": "修复已有代码中的错误、失败测试、运行异常或不符合预期的行为。",
      "intent_examples": [
        "跑不通",
        "报错了",
        "测试失败",
        "这个 bug 帮我修一下"
      ],
      "bound_skill_patterns": [
        "systematic_debugging",
        "test_driven_development",
        "surgical_change"
      ],
      "allowed_actions": [
        "read_files",
        "search_code",
        "run_relevant_commands",
        "edit_scoped_files"
      ],
      "forbidden_actions": [
        "unrelated_refactor",
        "change_public_api_without_need",
        "delete_user_changes",
        "claim_success_without_verification",
        "install_unapproved_dependency"
      ],
      "tool_policy": {
        "read": "allowed",
        "write": "scoped_to_impact_files",
        "network": "approval_required",
        "dependency_install": "forbidden"
      },
      "runtime_environment": {
        "auto_inject_local_env": true,
        "context_breaker_on_switch": true,
        "evidence_capture": "system_sandbox",
        "audit_log_write_access": "system_only"
      },
      "routing_target": "debug_fix_workflow",
      "model_policy": {
        "temperature": 0.0,
        "max_retry_limit": 3,
        "load_minimal_context": true,
        "prefer_deterministic_steps": true
      },
      "required_steps": [
        "捕获系统环境报错日志与失败上下文",
        "提取并运行最小失败复现用例",
        "锁定受影响的文件与行号",
        "执行外科手术式修改",
        "运行本地单测与构建验证",
        "导出由系统层捕获的验证证据摘要"
      ],
      "verification": {
        "required": true,
        "evidence_source": "system_sandbox_stdout_stderr",
        "acceptable_evidence": [
          "test_output_hash",
          "build_exit_code_0",
          "manual_reproduction_result_hash"
        ],
        "audit_fields": [
          "timestamp",
          "command",
          "exit_code",
          "stdout_digest",
          "stderr_digest",
          "sha256"
        ]
      },
      "fallback": {
        "when_confidence_below": 0.75,
        "action": "ask_clarifying_question_or_route_to_查",
        "on_max_retry_exceeded": "MELT_DOWN_TO_查",
        "on_meltdown": "revoke_write_permissions_and_emit_bug_report"
      },
      "reference_workflow_patterns": [
        "superpowers:systematic-debugging",
        "superpowers:test-driven-development",
        "superpowers:verification-before-completion",
        "engineering:surgical-change"
      ],
      "professional_protocol": {
        "source_projects": [
          "obra/superpowers systematic-debugging",
          "obra/superpowers test-driven-development",
          "SWE-agent issue-reproduction workflow"
        ],
        "operating_logic": [
          "先捕获真实失败日志和最小复现路径",
          "定位根因并区分配置、依赖、逻辑和环境问题",
          "只修改受影响文件，优先补充回归测试",
          "运行验证命令并记录系统层证据摘要"
        ],
        "hard_gates": [
          "没有复现或证据不得宣称修复",
          "连续失败超过重试上限必须熔断到查",
          "禁止安装未批准依赖或重写无关模块"
        ]
      },
      "root_opcode": "修",
      "opcode_vector": {
        "permission": "write_scoped",
        "context": "clean_on_switch",
        "evidence": [
          "reproduction_result",
          "diff_summary",
          "test_output_hash"
        ]
      },
      "inheritance_policy": {
        "can_relax_permission": false,
        "can_add_evidence": true,
        "context_must_not_expand": true
      },
      "six_phase_workflow": [
        "捕获真实失败上下文",
        "建立最小复现路径",
        "定位影响范围",
        "执行最小必要修改",
        "运行验证命令",